{
  "id": "scd:project:alpha",
  "type": "project",
  "title": "Alpha",
  "version": "1.0.0",
  "description": "Release gates",
  "content": {
    "summary": "Release gates",
    "directives": [
      {"id": "A-001", "directive": "Run the full regression suite before every release."}
    ]
  },
  "provenance": {
    "created_by": "Jane Doe <jane@example.com>",
    "created_at": "2026-10-19T08:30:00+00:00",
    "rationale": "test vector"
  }
}
