{
  "id": "scd:project:beta",
  "type": "project",
  "title": "Beta",
  "version": "1.0.0",
  "description": "Sites",
  "content": {
    "summary": "Manufacturing sites",
    "facts": [
      {"id": "B-001", "fact": "Sites: Zürich – Ωmega Werk, 東京工場."}
    ]
  },
  "provenance": {
    "created_by": "Jane Doe <jane@example.com>",
    "created_at": "2026-10-20",
    "rationale": "test vector"
  }
}
